Dr. Bhavana Pothuri,Dr. Pothuri listens to her patients and believes in doing what is medically necessary and no more. She spends sufficient time with the patient offering a full explanation of the medical issue and the possible treatment options. She has patience for all questions and a wonderfully helpful office staff. My surgery was a complete success with no complications and a very quick recovery. It is so rare to find a doctor who actually listens and treats the patient as a human being
Dr. Bhavana Pothuri,"DR. POTHURI WAS EXTREMELY PROFESSIONAL, KNOWLEDGEABLE AND COMPASSIONATE. SHE TOOK THE TIME TO EXPLAIN IN DETAIL AND PUT YOU EASE FOR THE ENTIRE PROCESS FROM START TO FINISH. NOT ONLY FOR ME BUT FOR FAMILY MEMBERS AS WELL. MY ENTIRE SURGICAL PROCEDURE WAS DONE WITHOUT ANY PAIN BEFORE OR AFTERWARDS. HEALING WAS QUICK WITHOUT ANY COMPLICATIONS"
Dr. Sabrina Nilufar,She needs an attitude adjustment. I am going to switch doctors. She's unprofessional and talks to everyone around her in a condescending manner. She's also very unorganized. If she could communicate better maybe things would run more smoother with her patients
Dr. Sabrina Nilufar,"I left crying; she was very rude, tough and she had a bad bedside manner. She had no compassion whatsoever to my situation, she was talking over me all the time like she was lecturing me and when I try to explain what I'm feeling she tells me in a condescending way to let her finish! she didn't take into consideration that I was in pain and didn't even suggest any painkillers or anything. It was like I am begging her for medical attention"
Dr. Sabrina Nilufar,I’m 66 year old but this was one of worst doctor I ever visit in my life
Dr. Mark Moradi,"Love Dr. Moradi, but unfortunately I will be switching doctors as his staff is extremely unprofessional and unpleasant. Specifically Anna and Melba whom which I will file further complaints and fraud against."
Dr. Mark Moradi,I have been with Dr. Moradi for over 20 years . I trust his advice with my health decisions . He has exceeded my expectations of any Doctor that I have encountered . He has found treatment that has been unconventional but proven to be successful for me . I travel from a different county to see him & will continue to do so wherever he goes . His staff is caring & empathetic. I have always left his office understanding all my options 
Dr. Mark Moradi,"Dr. Moradi is a wonderful Doctor. He is proficient and thorough. His work is stellar and impeccable. His bedside manner is exceptional. He is very caring, reassuring and doesn't rush. Dr. Moradi explains your diagnosis and answers any and all questions that you have. He makes sure that you understand everything. Dr. Moradi is genuinely concerned about your health and well being. He is meticulous and excellent with following up with test results phone calls, and appointments. His staff is great."
Dr. Mark Moradi,"Exceptionally caring physician, committed to his patients. I have been fortunate to have Dr. Moradi as a physician for almost a decade, he is very knowledgable in his field, thorough in his treatment and goes above and beyond his duties to ensure each patient get individual care from the moment you enter this office. Equally caring is his staff from the common courtesy follow up calls often not returned by other physician offices to the prompt scheduling of appointments. Exemplary physician"
Dr. Mark Moradi,"I've been with Dr Moradi over ten years and I find him to be excellent in his profession. He is knowledgeable, thorough, listens tentatively and stops to address each and every concern. He doesn't hesitate to take my phone call if a situation arises after my visit. I always leave his office feeling confident with the wealth of knowledge he has imparted in regards to my medical concern"
Dr. Mark Moradi,"I was amazed with the level of dedication, courtesy, knowledge, care, professional expertise and advice received by the doctor. He literally went out of his way to answer my questions and concerns. I would definitely recommend Dr.Moradi to everyone in my family. I've seen many doctors. This one is outstanding"
Dr. Matthew Lederman,"If you are suffering from complications due to Asherman's Syndrome then Dr. Lederman is not the right endocrinologist, find a more skilled professional"
Dr. Matthew Lederman,"I first visited Dr Lederman in 2014, after an ectopic pregnancy in 2012 and another year and a half of trying to conceive with no luck. With the help of RMA and IVF, our first son was born in Dec 2014. Due to the success of our first experience and our comfort with and confidence in the RMA team, we returned to Dr. LEDERMAN when we were trying for our second child, and again, with their help, our 2nd son was born in May of this year. We have nothing but good things to say about Dr Lederman"
Dr. Matthew Lederman,"I can't say enough good things about this doctor and this facility as a whole. I was a patient in the White Plains office and had some procedures at the NYC offices. The doctor and staff are caring, compassionate, organized, and helpful. They helped my husband and I navigate through the complicated process and fertility treatment. We are expecting your first child in September!!! I am sad to have to them."
Dr. Matthew Lederman,I cannot even express in words how wonderful Dr Lederman and his staff at RMA were to me during my pregnancy difficulty. He is brilliant and cares deeply for his patients. Fortunately I was successful at getting pregnant but for two years I struggled with real fertility issues and Dr Lederman kept me positive with realistic goals in mind. I cannot thank him and the staff at RMA enough for what they have done for my family. I deeply miss them
Dr. Matthew Lederman,"Doctor Lederman was wonderful. Great bedside manner, always pulling for us until the good news finally came! Highly Recommend."
Dr. Matthew Lederman,"I had been able to successfully get pregnant on my own before, but when it came time to try to get pregnant for a 3rd time I was having trouble. I can now say that after 3 medicated cycles, 3 IUIs and 1 round of IVF I am in my third trimester with a healthy baby girl. I am so thankful to Dr. Lederman. He was really the kindest and most honest doctor I have ever worked with. Going through infertility treatments is no picnic, but Dr. Lederman was there for me every step of the way. He really cares"
Dr. Matthew Lederman,"Dr. Lederman is exceptional. I saw him for IVF treatment & gave birth to my baby in June. While there are many, one of his most impressive characteristics is his level of knowledge and his desire to continue to expand his learning. I have a unique genetic disorder & when I met with him he made it his mission to learn about it & even joined a panel of medical and scientific professionals focused on researching the disorder I have. My confidence in Dr. Lederman is immeasurable"
Dr. Matthew Lederman,We are so thankful we found Dr. Lederman. We went through 3 rounds at two other clinics (both associated with top NYC hospitals) without any success before finding RMA. He explained our treatment to us and was extremely supportive from the first appointment until we 'graduated' to our OB. He was always available for a phone consultation between appointments and made a difficult process easier on us
Dr. Matthew Lederman,Dr. Lederman went above and beyond to make me feel comfortable. He was knowledgable and patiently answered all of my questions during my visits. His staff is also amazing. I would highly recommend Dr. Lederman
Dr. Kenneth Levey,"If i could leave 0 Stars i would... My surgery was LAST AUGUST (2017) robotic assisted endometriosis removal. Dr. Levey knew I had a UTI from my pre-op appointment & never prescribed medicine. He told me while I was being prepped to go under, saying that the medicine would be ready immediately for pick up afterwards. He then operated on me WITH AN INFECTION. While in recovery, he left the hospital without signing discharge papers. The hospital staff was beyond angry claiming that he never"
Dr. Kenneth Levey,"Had to have an endometrial biopsy which I was dreading because of the horror stories. However when I expressed my fear he understood, gave me something to relax and a cervical block. Had slight cramp during the 30 sec procedure and some pink spotting. That was it. I also took 3 Motrin before but it was really nothing with the anesthetic.   Staff however should have called me to tell me he doesn't accept GHI any more.  Had Novasure procedure too in 2014 in office"
Dr. Kenneth Levey,"he did NOT any thing in my surgery, he just a greedy doctor. His invoice is so expensive and nothing was done by him, I had one surgery after him they found every thing as described in his MRI."
Dr. Kenneth Levey,"Arrogant, awful, money-grubbing doctor. If you want to read real reviews--and not the ones his staff makes up--visit Yelp"
Dr. Dimitry Goncharov,"Looking for an ObGyn who is in awe of the miracle of giving birth (as opposed to the business of being born), with less then 10% C-section rate? Look no further! Dr. Goncharov is THE ONE"
Dr. Dimitry Goncharov,I had a successful hysterectomy procedure performed on Jan 29th by DR GONCHAROV He is a amazing the best. Because of my health I had many medication restrictions.DR GONCHAROV took all my restrictions serious. He performed my surgery with a great O.RTEAM at Beth Israel Mount Sinai. I was able to walk the next morning. My bathroom needs was painless. From my first appointment I had confidence in him. He cares and always pleasant. When you love what you do it shows in your performance. MIRACLE
Dr. Andrew Gardner,"Dr.Gardner is an excellent physician. He is knowledgeable, very kind and patient.He explains everything in detail and is always very competent and reassuring. He is skillful and truly has golden hands.He gives me the best exams I ever had in my long life - no discomfort whatsoever! He is warm and thorough and very easy to talk to.He deeply cares about his patients and addresses all my concerns.I have known him for many years & trust him completely. I just love him and so will you"
Dr. Andrew Gardner,Dr. Gardner delivered my 5 children c-section. All my children were full term & healthy thank GOD. I am 41 years old and just had my last baby June 2016. I highly trust and recommend Dr. Gardner.
Dr. Andrew Gardner,"He is amazing! The end of my pregnancy was difficult and also during the birth we had serious complications but he did a great, great job. I trust him and in all difficult situations he was calm, concentrated, very patient and professional. Also his staff is very, very nice and gave me all the time helpful support!"
Dr. Andrew Gardner,"I have been a patient of Dr. Gardner for 23 years. I first met him when I was pregnant with my youngest son after experiencing a late pregnancy (5 months) miscarriage. From the start, Dr. Gardner was compassionate, understanding and available to me. His professional care was and has been ever since, extraordinary. He has seen me through menopause and in every step of the way he has provided best medical advice and care while having a personal touch. He still asks about the baby! He is 22"
Dr. Osbert Fernandez,Excelente doctor
Dr. Osbert Fernandez,"Amazing doctor! Highly recommend! Makes you feel comfortable in every type of way, which is great. Love this doctor! :) The staff is super helpful and friendly, love them as well."
Dr. Osbert Fernandez,"Excellent doctor! He has a very nice demeanor and bedside manner. I have been very happy with his services. The office is modern, clean and up to date. The staff is friendly and courteous. I would recommend this office without reservation"
Dr. Osbert Fernandez,"Dr. Fernandez is an exceptional Doctor. I recommend him to anyone hands down. I have been seeing Dr. Fernandez for almost 4 years now. He is amazing, attentive, but most importantly doesn't make you feel like another medical number on his appointment list. Thank you for always making me feel supported and genuinely cared for. I feel lucky to have a doctor I can trust and enjoy coming to. I always feel so comfortable here. Thank you for being so caring, supportive and helpful. You’re the best"
Dr. Osbert Fernandez,I have four children and with the last pregnancy I seen Dr. fernandez... He is the best.. He cares about his patients and what is in their best interest. He exlplains everything in full detail. and he will see you immediately whenever there is a problem. Dr. Hyman Delivered my daughter as I had to be induced immediately and she was also wonderful. great bed side manner and makes you feel at ease. My daughter is now 19 months & im changing insurance so i can go back to them for next pregnancy
Dr. Osbert Fernandez,I have four children and with the last pregnancy I seen Dr. fernandez... He is the best.. He cares about his patients and what is in their best interest. He exlplains everything in full detail. and he will see you immediately whenever there is a problem. Dr. Hyman Delivered my daughter as I had to be induced immediately and she was also wonderful. great bed side manner and makes you feel at ease. My daughter is now 19 months & im changing insurance so i can go back to them for next pregnancy
Dr. Osbert Fernandez,This maybe the best OBGYN I have ever seen by far! Dr.Fernadez is a class act makes you feel at ease and explains every detail of the procedures in a language you can understand .. I feel great after my surgery I barely feel any pain amazing
Dr. Osbert Fernandez,I love Dr. Fernandez! I have a tiny c-section scar thanks to him. He made sure my baby and I were ok! Will def recommend!
Dr. Osbert Fernandez,"Dr. Fernandez is truly a do diamond in the sea of coal, when it comes to Doctors. He truly loves his life's work which is evidenced in his professionalism, respect and humor. I would HIGHLY recommend him to all ladies out there looking for a quality doctor that still cares about his patients"
Dr. Osbert Fernandez,I am extremely grateful to Dr. Fernandez for diagnosing me correctly and for performing a successful surgery. I am healing properly now with the great care and attention from Dr. Fernandez and his team. The girls in his office were very helpful throughout the process and should not go un-noticed
Dr. Osbert Fernandez,"Horrible to understand, didn't even have my file at hand during my appt. I was there for results and answers about a procedure needed to be done, but he comes and he asked my daughter and me what was wrong? when asked about my file, he said he had so many patients he didn't get a chance to get my file, yet I am sitting there and he never asked one of the assistants to get it. It was like he was trying to brush us off. I DO NOT TRUST HIM or recommend"
Dr. Osbert Fernandez,Great obgyn took care of me during pregnancy & after
Dr. Osbert Fernandez,Caring and full of knowledge!! He can take care of my me and my daughters anytime!
Dr. Osbert Fernandez,Not very attentive doesn't explain things in a way you can understand. Doesn't spent much time with patient.... I will not recommend him to any one.
Dr. George McQuilkin,"I was lucky to find Dr. McQuilkin after moving to Jersey City in the middle of my first pregnancy. He is the most relaxed doctor I’ve ever had. I wanted to give birth with as few interventions as possible, and Dr. McQuilkin was respectful of my decision even though I was in labor for 44 hours. He was incredibly patient throughout and never made me feel rushed or anxious about anything. His bedside manner makes you feel very comfortable. I highly recommend him and the Pampered Pregnancy Program"
Dr. George McQuilkin,I would highly recommend Dr Mcquilkin to be the best obgyn.He made my journey of pregnancy so easy n comfortable.Overall he is nice and i feel I was in safe hands
Dr. George McQuilkin,BEST DOCTOR EVERRRRR
Dr. George McQuilkin,"Dr. McQuilkin is a gentle, kind doctor. Never in a rush to call the next number. He makes you feel comfortable and reassured. He delivered both of my children as well as nieces and nephews. You could not find a better doctor. He becomes a part of your family over the nine months you spend in his care"
Dr. George McQuilkin,He actually was the doctor who delivered me and I am now 20 and seeing him as my OBG. Great bedside manner. Very comfortable having him as my doctor.
Dr. Allan Ho,"Dr Ho is a professional and excellent doctor.He helped me delivery my baby successfully.And Recently, he helped me remove a cyst in my R ovary and still successfully remained my R ovary.I am grateful for what he did"
Dr. Allan Ho,"Dr. Ho performed a total hysterectomy on me this past May, to remove a uterine fibroid. He is absolutely one of the Best doctors/surgeons and is also affiliated with one of the best hospitals in NY. He was referred to me by my GYN of 30 years and I am so grateful to have been in such great hands and care. I highly recommend him! He is kind, attentive and a great human being"
Dr. Allan Ho,"I have a 9 cm of uterine fibroids, such a large fibroids with laparoscopic surgery is very difficult to remove, I'm lucky met the Dr. Allan Ho His superb medical skill, serious and responsible, successful help me remove the fibroids with laparoscopic surgery, and postoperative recovery soon, I thank him very much, here also recommend any doctor, he is a skilled conscientious good doctor"
Dr. Allan Ho,"Discussing the upcoming surgery Dr Ho calmed my fears, explained everything thoroughly, and inspired me with confidence that I would be all right afterwards. Coming to after the surgery, I felt no discomfort. I healed well and with no complications.. As I resumed my sex life I was still very protective of the actual scar, the stitches on my lower abdomen. But the sex was good and unchanged from what it was before, and the way my vagina felt and my muscles functioned was just superb"
Dr. Allan Ho,"Dr. Ho is the best OBGYN in New York City. I have had numerous procedures, including a full Hysterectomy. I trust him completely . He is attentive and listens to how you feel so get the best possible care. I highly recommend"
Dr. Allan Ho,"Very amazing doctor! He's very accurate and thorough and takes his job serious and gives out the absolute best advice. He's performed several SUCCESSFUL procedures and the biggest BLESSING of all HE DELIVERED my baby with no complications, up and walking like normal 2days after having a c-section, I didn't even need the pain medicine that was prescribed! This Dr. has the hands of god!! Thank you so so very much for everything Dr Ho. Your such an awesome dr and I can't thank you enough"
Dr. Allan Ho,Dr. Ho is the best gynecologist when it comes to removing an ovarian cyst.
Dr. Allan Ho,"Dr. Ho is truly amazing! Before my friend recommended him to me, I saw three surgeons who all said I needed a ""bikini"" cut for my hysterectomy. Dr. Ho said he was confident that he could do my surgery through three tiny incisions narrower than my pinky. He performed my surgery without a hitch. I was only a little sore afterwards and didn't even need to take pain pills. Two months after the surgery, the scars were barely visible. My pain and heavy bleeding before the surgery were all gone"
Dr. Allan Ho,"Dr. Ho is an amazing doctor!! He and his fantastic team delivered our healthy baby boy, and made it's all seems so easy. he is caring and compassionate and attentive to the needs of his patients, I wish I could give him six stars!! we're definitely going to him for our next baby. Thanks again Dr. Ho."
Dr. Allan Ho,"I recently had a myomectomy performed by Dr. Allan Ho with Charles Wang Community Heath Center that was everything I hoped. Dr. Ho was extremely empathetic. My interaction with him epitomized what the Doctor- patient relationship should be. He listened and worked to put into practice the decisions I made for my care. When necessary he provided essential medical guidance, always expressing to me his concern and respect for my role as decision maker in this relationship. I recommend Dr Allan Ho"
Dr. Allan Ho,"I have been a patient of Dr Ho for many years ,monitoring my endometriosis condition.Finally in November, Dr Ho performed a laparoscopic hysterectomy on me.I had a painless and speedy recovery thanks to this great doctor.I'm so grateful to have him as my trusted gynecologist all these years"
Dr. Allan Ho,"Dr. Ho did an excellent job of caring for my mother-in-law before, during, and after her surgery. She was very pleased with his bedside manner and his ability to explain and support her unique wishes in relation to the procedure. He was very respectful of her personal opinions and body, and incorporated that into her treatment. Thank you, Dr. Ho"
Dr. Allan Ho,"I have never met a Doctor so professional, hardworking, caring and friendly. I was amazed to find a doctor spending so much time with his patients. Dr. Ho performed surgery on me, 2 weeks ago and I was so impressed on how he performed.I went into the OR knowing that everything would be fine.I had no complications, no infection, less pain, neatly done and most of all his attitude and smiles gave me the assurance and confidence for his success. Thank you Dr. Ho and your team for a job well done"
Dr. Allan Ho,I had an approximately 20cm big ovarian cyst. Dr.Ho recommended me to have a bikini cut when all the other doctors told me that a large cut on the belly was the only choice. There was a cancer expert asked me to sign a consent form which stated to have the ovarian cyst remove with my left side ovary which scares me!! The surgery that Dr.Ho provided went extremely well and it only leaves a 6cm cut. I highly recommended Dr.Ho
Dr. Allan Ho,"When I was told I required surgery, I was referred to Doctor Ho. I was scared but relieved after meeting the doctor. He was professional, kind, and very caring; he patiently explained the surgical procedure to me and took his time to answer all my questions. My surgery was scheduled for 6/21/16 and went extremely well. The doctor was there for me before and after the operation. He is a wonderful person and a great doctor. I highly recommend him"
Dr. Anca Rosca,"Fantastic, professional doctor. Responsive, knowledgeable and friendly demeanor. She centers on the patient's needs and doesn't let personal views effect her service to the patients. Very trustworthy, highly recommend her"
Dr. Anca Rosca,"Dr. Rosca delivered my daughter, she was very thorough and had a good bedside manner. I never felt rushed, and always felt welcome to ask questions. I had an extremely complicated delivery/c-section. My c-section required a very high level of expertise and I'm so grateful I had Dr. Rosca as my doctor. She is a very skilled surgeon and was able to act quickly to save my daughter's life. I cannot recommend her enough."
Dr. Bernadith Russell,"Meeting with Dr. Russell in person was fine, but reaching the office has been unimaginably frustrating. It is nearly impossible to get anyone on the phone, and there is no option to leave a voicemail. I saw Dr. Russell in late winter/early spring, and now in October I am still struggling to gain access to basic labs. She also did not run a panel that she said she would run for me, and it took 5 calls to even get that information. I am still waiting to gain access to what results are available."
Dr. Bernadith Russell,Dr. Russell is great! She is caring and warm. She is a good listener and love the fact she looks at your whole wellness taking into consideration whats happening in your life to your health. She delivered my son and supported my decision to ensure it was a natural birth and did all she could do to ensure I wouldn't have a C-section. I choose her because of that fact that she didn't encourage you to have a C-section especially as an older mom
Dr. Bernadith Russell,Dr.Russell Wonderful listener excellent doctor
Dr. Bernadith Russell,"I love Dr. Russell's approach. She's warm and no-nonsense at the same time. I've been with her for years, and she has been wonderful throughout my pregnancy -- making me feel comfortable and putting my husband at ease (no small task). Extremely knowledgable and great at phasing questions so that we're worrying about the right things at the right time."
Dr. Thomas Caputo,"Dr Caputo is by far the most thorough Gyn/oncologist. He has saved my life. Their are know words that can be said about him that would be ever not professional nor abrupt. I would refer him to anyone that would be in need of a Gyn/oncologist. His surgery, speaking for myself was a miracle. I had Stage four cancer in 2001. I am forever thankful to him and his wonderful staff. They have been so hand picked by Dr.Capto,so concerned and heartfelt for every patient. GOD BLESS them"
Dr. Thomas Caputo,"Dr. Caputo is great. Highly recommend him. He was my surgeon in 2000 and I still see him for a yearly checkup every year. Totally trust him, and he takes time to answer your questions. He is an excellent doctor and a good man."
Dr. Thomas Caputo,Dr. Caputo is a very caring and positive doctor.
Dr. Thomas Caputo,Dr. Caputo is an excellent Dr. Very thorough and gave me a quick and accurate diagnosis and performed a procedure that was extremely successful
Dr. Thomas Caputo,Very experienced doctor
Dr. Thomas Caputo,He is the best! ?????????? Great diagnostician . I have been going to him for about 15 years or more. He is very honest and always guides me to the right doctor for whatever I need at the moment
Dr. Thomas Caputo,Very experienced Pro active Easy to talk to
Dr. Thomas Caputo,"Excellent, brilliant, compassionate, thorough, and understanding."
