Dr. Yuri Novitsky,"Dr. Novitsky and his team were incredible. His attention to my particular problem and willingness to discuss options and procedures with me was incredible. Once the surgery was completed, Dr. Novitsky was available to answer any questions I or my family had about recovery. I travelled to Cleveland's University Hospital for Dr. Novitsky's expertise and the entire experience was worth the trip. Dr. Novitsky and his staff went above and beyond in providing excellent care to me at all times"
Dr. Yuri Novitsky,"Dr. Novitsky is the best Ventral Hernia Surgeon in the Cleveland, Ohio area. He is superbly qualified, kind, compassionate and thorough. I am told my surgery was 7+ hours long. Imagine the ability of this surgeon in a marathon event, to afford me the fabulous result and my life"
Dr. Yuri Novitsky,"Dr. Novitsky is the best Ventral Hernia Surgeon in the Cleveland, Ohio area. He is superbly qualified, kind, compassionate and thorough. I am told my surgery was 7+ hours long. Imagine the ability of this surgeon in a marathon event, to afford me the fabulous result and my life"
Dr. Yuri Novitsky,Dr. Novitsky did an experimental umbilical hernia repair for me 2 years ago. He saved my quality of life!! I was constantly in pain and had 2 failed repairs from a different hospital before I found Dr. Novitsky. I cannot recommend him enough enough. He is wonderful and because of his expertise I am able to live a full life without having to worry about my hernia ever again
Dr. Yuri Novitsky,"Dr. Novitsky is a very caring professional who made me feel very much at ease with his knowledge and demeanor. I appreciated that when I first went to him regarding my inguinal hernia, he indicated that it was too small for surgery at that point and that I should wait. When it was time for surgery for that hernia and another one that developed on the other side, the procedure went very well and I healed fully without any complications. He answered all of my questions both before and after the"
Dr. Yuri Novitsky,Dr Novitsky and staff are a great asset to University Hospitals. I wouldn't hesitate to recommend him to anyone needing hernia surgery
Dr. Yuri Novitsky,"Professional, Knowledgeable, Experienced"
Dr. Melissa Pilewskie,"Dr. Pilewski was wonderful, both as a surgeon and as a person. She provided me multiple options but also respected my final choice not to have reconstruction. The result was exactly what I asked for, and her calm demeanor helped me get through a very scary time. A year and a half later, I am just as satisfied. The work she did, the care she took--I strongly recommend her"
Dr. Melissa Pilewskie,"I feel very lucky to have had Dr. Pilewskie as the surgeon who performed my lumpectomy. She is extremely thorough, patient and had a lovely bedside manner while displaying much confidence and knowledge. ISloan Kettering is an amazing facility with a kind and patient staff"
Dr. Melissa Pilewskie,"Dr. Pilewskie is the best! She has great bed side manner, she listens, answers questions, very knowledgeable and most importantly compassionate. I would highly recommend her"
Dr. Melissa Pilewskie,"Dr. Pilewski is everything you want in a surgeon. Patient, compassionte, and highly skilled! I would recommend her to anyone. She did a wonderful job on my lumpectomy. She is also down to earth and does not have The god complex. You won't be disappointed"
Dr. Melissa Pilewskie,The best
Dr. Stephen Goldstone,"Nothing good can be said here. He's knowledgable, of course, but he's rude, impersonal, and seemingly short with the patients"
Dr. Stephen Goldstone,"Dr. Goldtone and his staff are extremely competent in their areas of practice. From Reception, to insurance billing , doctor care and surgeons- all are friendly and patient. Jonathan Baker, the PA is an exceptionally good healthcare provider. I never had any post operative complications and a last minute appointment or change is always granted"
Dr. David Greuner,"Dr. Greuner is a smart, compassionate, effective, fantastic doctor. I have been going to various doctors for years trying to understand what was causing such a variety of painful, uncomfortable, strange symptoms. Diagnosed with a very large fibroid, my GYN recommended an ineffective treatment plan. Luckily, a little google-fu led me to Dr. Greuner, who 1) identified a secondary condition caused by the fibroid and 2) addressed both problems quickly. It feels like a miracle! He listens, he cares"
Dr. David Greuner,"WARNING. David Greuner operated on my leg for varicose veins. After he performed a phlebectomy, my leg swelled up, turned red, and became very hot. It was very painful to walk. When I returned for a follow up, Greuner gave me antibiotics and told me my leg would improve in time. My leg continued to get worse. I went to the NYU Vein Center. They performed an ultrasound and found the cause of my injury. Greuner had cut and left an open vein in my leg"
Dr. David Greuner,"Kudos to Dr. Greuner, lovely Joelle, and staff for creating an outstanding as well as caring environment. Even though the Venogram seemed like a procedure of concern, you managed to allay all my fears, wisely diagnose my condition and provide your expert suggestions. As observed, you listened attentively to your patients' needs and apprehensions, providing sound counsel through your vast knowledge and competence. Thank you so very much for your help. Diana W"
Dr. David Greuner,I had a very unsatisfactory experience with Dr. Greuner and his assistent who administered the piercing process to rid me of spider veins . Within 2 weeks I have acquired an infection and swelling in one area and there is no general improvement what-so-ever! My thighs and calfs are polka-dotted with puncture marks and the spider veins on my thighs are more prominent than ever
Dr. Steven Hofstetter,"My experience was bad. Dr. Hofstetter's office made and then cancelled 2 appointments with me.. They then tried to make a third one, and i refused. They are very unprofessional and careless.. Avoid them"
Dr. Evan Matros,"Dr. Matros was an angel that was put in my life. He is one of the most caring and genuine persons I know. He is also the most talented breast reconstruction surgeon; he has done several surgeries on me and said until it's just right for me, then all is good. He did a magnificent job. He and his whole staff are compassionate and full of personality. I love this man and am so grateful for his artistic talent"
Dr. Evan Matros,Dr. Matros is an artist in breast reconstruction. I was so paranoid because first the tissue expanders where horrible. They moved and were very hard. And then seeing pictures on line of mastectomy/reconstructed breasts was not easy finding good results pictures. Dr. Matros assured me they will be what I wanted and a natural feel. And he delivered. He also is sensitive to what you are going through as well. Which is important. Highly recommend!!!!!! Thank you Dr Matros
Dr. Evan Matros,"Amazingly talented, caring"
Dr. Evan Matros,"Dr. Matros made the entire process seamless and like a walk in the park. His knowledge and demeanor made me feel confident and secure and that anything is possible. He said to my husband the morning of the surgery ""she's perfect and she'll remain perfect."" Enough said"
Dr. Evan Matros,"Dr Matros is a fantastic doctor. He performed three surgeries to reconstruct my breasts after a double mastectomy. I was a bit skeptical after our initial consultation as he's not the most warm and fuzzy doctor and wants to make sure your expectations are realistic. However, he won me over after surgery. He does amazing work (opinion of several oncologists) and also doesn't place unnecessary restrictions after surgery, which made a world of difference in my recovery. I'm forever grateful"
Dr. Evan Matros,"The most caring knowledgeable talented doctor. He has listened to us with attentiveness and genuine care. He has operated on my wife impeccably, he has advised us with explanation and prudence he has treated us as if we were his own. My family has been blessed and extremely fortunate to have him n our lives. He is our quarterback. Thank you Dr. Matros"
Dr. Evan Matros,Dr. Matros was referred to me by my breast surgeon Dr. Scalfani. I can't thank her enough because he's an amazing surgeon. The whole team at Sloan Kettering have given me such confidence and made this whole process incredibly easy. Dr Matros has done an amazing job thus far with my reconstruction and I highly recommend him.
Dr. Evan Matros,The best plastic surgeon I know. He really knows what he's doing and Beyond a perfectionist. He is also one of the nicest guys and easy to talk to and will be totally honest with you couldn't get through my breast cancer without him. Thank you for everything
Dr. Evan Matros,"Dr Matros is truly an amazing Doctor. He is smart and kind and will spend as much time as you want/need, without making you feel like your questions are tedious and unnecessary, as some doctors are wont to do. Putting your trust in Dr. Matros is truly like putting your trust in a friend. I would (and have) recommend him with 100% confidence"
Dr. Evan Matros,"I had the tissue flap reconstruction on both breasts in 2015. Dr. Matros spent 12 hours on my surgery, and nobody could have done a better job than he did! Even I had radiation on the left side before, the result is amazing. My breasts look very natural, and I can swim 10 laps and go on ski trips with no trouble after just six months. Dr. Matros is extremely professional. He is willing to spend time to discuss the options with patients and listen to their concerns. He is truly a great doctor"
Dr. Evan Matros,What a wonderful and caring doctor!!! He did my reconstruction surgery after breast cancer. I would recommend him one hundred percent! Thank you Dr. Matros for all you did for me and all you patients
Dr. Marsha Harris,"Very knowledgeable , patient, explains very well and compassionate. I just started seeing Dr. Harris and she was wonderful on all levels. Highly recommend"
Dr. Marsha Harris,I had surgery on October 19th Dr Harris explained just what she was going to do in terms I could easily understand. First appointment I had complete confidence and liked her she is caring and did a great job. I feel great . She is what we all think of as a great Dr
Dr. Marsha Harris,She's amazing. She has expertise and a very caring demeanor
Dr. Marsha Harris,Dr. Marsha Harris performed a surgery on me for sigmoid diverticulitis. I am a 33 year old female and this was my first ever surgery. She not only has amazing bedside manner but she took the time to answer all my questions and made me feel at ease. The operation was a success and I am healing beautifully. Not only is she incredibly competent in her profession but she has such a warm personality as well. I would highly recommend her
Dr. Marsha Harris,"Excellent surgeon and very personable, which is very rare in patient care today"
Dr. Marsha Harris,"Dr. Harris is knowledgeable, kind and gentle - I was very nervous and she put me completely at ease. She took the time to explain my condition and treatment. Highly recommend"
Dr. Richard Lazzaro,"Dr. Lazzaro is a ,wonderful surgeon. His robotic surgery leaves you in minor, almost non-existent pain and results in a very quick recovery. There is no need to look further than Dr. Lazzaro. You're not going to find better than him in skill and kindness"
Dr. Richard Lazzaro,"I was diagnosed with Thymoma. My primary highly recommended Dr. Lazzaro, for consultation. From my first visit I felt at ease. He described my condition in detail and the treatment required. It has now been one month since my successful surgery and am getting stronger each day.  It has been a pleasure being under the care of Dr. Lazzaro and his staff at Lenox Hill Hospital. I have been given a new lease on life. Thanks Dr. Lazzaro"
Dr. Richard Lazzaro,"Doctor Lazzarro has saved my life. I had lung cancer and a tumor on my spine. I just had surgery on June 14, 2016. He is the most caring , compassionate person. He truly cares about his patients. Always visiting his patients very early in the morning before he begins his other surgeries and when he's done , Dr. Lazzarro does his rounds again to visit his patients in the hospital. I truly admire him . He's a very dedicated doctor, I wouldn't trade him for any other surgeon"
Dr. Richard Lazzaro,Dr L is extremely rude and condescending to his patient and employees. I highly recommend going to Mount Sinai for ct surgery
Dr. Richard Lazzaro,"i had a third of my lung removed filled with cancer.Dr Lazzaro is the best within one day iwas up and about,very little pain"
Dr. Richard Lazzaro,"I had the laparoscopic, robotic-assisted repair of para-esophageal hiatal hernia with partial Nissen fundoplication by Dr. Lazzaro in October 2016. I found Dr. Lazzaro to be a very caring and compassionate as well as highly skilled surgeon. I was actually terrified before this surgery, although I thought I did a pretty good job of hiding it from everyone! Dr. Lazzaro answered all my questions before the surgery, I did very well, and he and his staff handled my follow-up issues promptly"
Dr. Richard Lazzaro,The best surgeon there is. He is an amazing doctor
Dr. Richard Lazzaro,I was referred to Dr. Lazzaro by my gastroenterologist and I am so thankful to have met him. I recently had hiatal hernia surgery at Lenox Hill Hospital with Dr. Lazzaro as my surgeon. I would highly recommend him as he is absolutely the best of the best
Dr. Richard Lazzaro,There is simply no better Doctor or human being than Doctor Lazzaro. My dad was struggling with health issues for years and Doctor Lazzaro was instrumental in helping him get the care and guidance he needed. He is the rare breed of Doctor who has as much heart and intelligence as he has skill and experience. I trust him implicitly with my life and with my family's life
Dr. Richard Lazzaro,Dr. Lazzaro is nothing short of a miracle worker. He treated my daughter like she was family. He made us feel extremely comfortable with not the most comfortable diagnosis to get. We were in his office and admitted the same day..operated on and finally my daughter was able to breath again!! Can't thank him enough for changing my daughters life
Dr. Richard Lazzaro,"An amazingly skilled doctor with an awesome, caring personality. He's the BEST"
Dr. Peter Geller,"Thorough, he took the time to explain the diagnosis, options, and answer all questions"
Dr. Peter Geller,"If you are a woman and you believe you have an occult hernia, do not waste your time with this man. Not only does he lack the knowledge to treat you, but he has zero compassion, which he makes up for with plenty of arrogance and willful ignorance. (I brought him the latest studies, and he refused to read them or even keep them to read later.) Maybe try the general surgeons at Mount Sinai, or the women's hernia doctor in LA"
Dr. Peter Geller,"An update: I got my MRI results back (from another doc) and, contrary to Geller's opinion, I do have a hernia. I don't mind that Geller made a gross error in his diagnosis as much as I am concerned about what he said: The search for the source of pelvic pain in women is often fruitless. He did not order imaging, nor did he conduct a proper clinical exam. And he covered up his own lack of knowledge about his purported expertise by trying to disempower me. Ladies, avoid this guy at all costs"
Dr. Peter Geller,"Dr. Geller was very sincere and knowledgeable. I did not have to wait long to be seen and in addition, his office staff was friendly and efficient"
Dr. Peter Geller,Dr.Geller performed a Bilateral Inguinal Hernia Repair in March 2011. His professional medical care was Superialy done with the constant concern of the patient .The operation was a great success.I would recommend Dr. Peter Geller highly
Dr. Joseph Martz,Dr. Martz was wonderful. He explained everything to me in a professional and caring way. One of the best doctors i’ve ever met. Alicia and his staff were knowledgeable and kind. I can’t say enough good things about my visit
Dr. Joseph Martz,Dr. Martz was very professional and caring. Thanks so much once again Dr. Martz...Huseyin Varna
Dr. Joseph Martz,"Dr. Martz and his entire team are the best ever. After my surgery Dr. Martz took time out of his busy schedule to call me every day to find out how I was doing. They truly care about you and go out of their way to help you and are so knowledgeable. Vicky, his PA, is excellent as well. Thank you for giving me back my life Dr. Martz. You are the best and I will never forget you and your entire team"
Dr. Joseph Martz,Dr. Martz provided very professional and thoughtful care to me. He is the best doctor I even meet! His team member Vicky she is a great assistant. Thank you so much for all you have done for me
Dr. Joseph Martz,"The best doctor/surgeon that truly cares about his patients! God bless him, he lengthened my father's life! Thank you so much Dr Martz and also Vicky you are also amazing! Thank you"
Dr. Joseph Martz,Just Excellent and his assistant Vicky!!! They both made me feel so comfortable and I trusted him in both my procedures!!! If only all doctors where like you Dr. Martz
Dr. Joseph Martz,"Dr. Martz is the most caring, compassion, personable, and knowledgeable Dr. that you will find anywhere. He and his Physician Assistant, Vicki, gave me complete involvement in my treatment in the most professional and caring way. I have unfortunately been admittedto Mt. Sinai hosptal for inrelated problems but when I see Dr. Martz on the hospital floor, I see him not just as a physician but as a friend"
Dr. Valery Dronsky,Dr. Dronsky was a very knowledgeable and highly talented surgeon. He completed the procedure in a timely fashion and his team of assistants made sure that I was treated with the utmost attention in the recovery room. I had three hernias repaired during one procedure and he was able to completely alleviate my pain in those three regions due to his profound surgical skills. It has been a month since the surgery was done and I feel no pain at all. I will without a doubt recommend this Surgeon
Dr. Valery Dronsky,"Dr Dronsky is an excellent surgeon with incredibles skills and on top of that he is very personable ! He took time to go over a procedure, post op instructions, he made sure the follow up was made !!! His staff is fantastic !!! I cannot thank him enough!!! I would strongly recommend him without hesitation"
Dr. Valery Dronsky,"Dr. Dronsky did my emergency appendix surgery in April. He is thorough, informative and has wonderful bed side manner. He made me feel comfortable throughout the process and is a skillful surgeon"
Dr. Valery Dronsky,"Dr. Dronsky was my surgeon for a recent appendectomy. Having gone to the hospital on a Saturday and having absolutely no choice in which surgeon would be removing my appendix, I couldn't have been luckier than to have Dr. Dronsky. He was thoughtful, truthful, and extremely caring from the first moment I met him in the hospital to the several follow-ups in the weeks after my surgery. The whole office staff feeds off the positive energy as well. Thank you all"
Dr. Valery Dronsky,"Dr. Dronsky did open ventral hernia repair on me. He was very professional and caring. He did an excellent job and I thank God that he was my surgeon. I would recommend my family, friends, and anyone looking for a good doctor"
Dr. Brian Harlin,It would be difficult to imagine a better doctor than Brian Harlin. He has it all and inspires great confidence
Dr. Brian Harlin,"Amazing experience.Amazing person.Polite,friendly,able to ask questions and he responds with intelligent answers.He also returns phone messages..He gives you quality time n threats u like a family member.Would highly recommend him.Office is spotless,wait time is not long at all(10mins)and office personnel is very nice.Had a problem for 4 years.Seen 3 other doctors.They Could not fix my health problem.He told me he can Help me.And he did..Works at top rated NYU.He deserves a 10"
Dr. Brian Harlin,"Very professional, communicative and earnest with up-to-date knowledge. Outstanding bed side manner with an overall compassionate disposition. An awesome doctor with accommodating professional staff"
Dr. Brian Harlin,"Very thorough ,very direct ,doesn't rush,great bedside manner. I would highly recommend. !!!!! Jack Gross "
Dr. Nolan Karp,"Dr. Nolan Karp is an excellent surgeon who is compassionate and cares about his patients. He performed a flap breast reconstruction on me and did an excellent job. He and his physician's assistant Brooke took the time to explain the procedure, and answer all my questions, and make me feel at ease before and after surgery. He has a great beside manner and is always smiling. He even takes the time to call his patients the day before surgery to check on you. All of his staff do a great job"
Dr. Nolan Karp,Dr Nolan preformed my breast reduction surgery the end of October 2017 I Couldn’t Have Found A Better Surgeon. Dr Nolan has a gentle caring manner. He has wonderful support in his office. They were always available for my questions or concerns. Dr. Nolan is the best
Dr. Nolan Karp,"Dr Karp and his staff were friendly, helpful and professional during my treatment"
Dr. Nolan Karp,"I had a mastectomy on my left breast last September, my second bout of breast cancer. I had my final surgery in January. Dr. Karp was a good surgeon and reconstructed my breast like the old one. All through out my healing, I had no pain......... His staff totally made me feel at home thru the process"
Dr. Nolan Karp,"Dr. Karp performed my breast reduction October 20, 2017. I recently had my final post op appointment, and I can honestly say this surgery has changed my life. I went from 34I to approximately 34D/DD. My scars have healed splendidly, and all of my physical ailments associated with my large breasts have all but disappeared (back/shoulder/neck pain, rashes and scarring from bras, headaches). Dr. Karp and his staff are topnotch, and made this experience seamless and stress-free. I have zero regrets"
Dr. Stephanie Bernik,"I started out with Dr Bernik at St Vincent’s Hospital and followed her to Lennox Hill Hospital. She performed all 3 of my lumpectomies, preserved as much breast tissue as she could and you can barely see the scars (seriously). She is kind, compassionate, understanding and her patient care and bedside manner is beyond excellent. Thank you Dr Bernik"
Dr. Stephanie Bernik,"She’s amazing, extremely cautious, and so knowledgeable"
Dr. Stephanie Bernik,The staff in this office and hospital is incompetent. You will be very frustrated communicating with this office
Dr. Stephanie Bernik,"I definitely recommend Dr. Bernik as your breast surgeon. She is very knowledgeable, skilled, progressive and compassionate. She performed a lumpectomy with mammoplasty on both breasts, and used a biodegradable implant called BioZorb. The surgery was a breeze. Despite the amount of tissue removed, my breasts look so similar to pre-surgery! I'm cancer-free now and I'm thankful she made my DCIS treatment go so smooth. Another plus is she teams up with an amazing plastic surgeon (Dr Dec). A team"
Dr. Stephanie Bernik,"Dr Bernik is an excellent professional, skillful surgeon and just a great human being. I had extensive surgery, Dr Bernik was there every step of the way. Dedication and love"
Dr. Stephanie Bernik,"I was a patient of Dr. Bernik when she was at St. Vincents Comprehensive Cancer center. She helped save my life! Not only with the wonderful incredible surgery preformed, but with the care and concerned showed during and after the whole process of my procedures. She is a great asset to who ever she treats and what ever facility she work with"
Dr. Stephanie Bernik,She is a very good person and professional doctor!She cares about patients.I would recommend to everyone.She did a a very good job .She's the best doctor!Love you dr Brenik
Dr. Stephanie Bernik,"Patient, caring and thorough"
Dr. Stephanie Bernik,"She is upbeat, thorough and very professional. She makes her patients feel at ease when they're dealing with serious issues. I recommend her highly"
Dr. Zachary Gleit,"Dr. Gliet repaired 3 abdominal hernias I had developed due to previous abdominal surgeries. In my opinion, he is the best and I would recommend him to anyone needing hernia surgery. He pays attention to his patients, and spends plenty of time explaining the surgery, the expected outcome, and answering questions. I consider myself lucky that I found him"
Dr. Zachary Gleit,"Extremely knowledgeable, professional and quick service. Dr. Gleit repaired my hernia in less than two hours. I woke up, then went home. Next morning, I felt great, much better than I expected"
Dr. Zachary Gleit,"Having Dr. Gleit for my inguinal hernia repair was definitely a right choice. He is a highly professional physician, and his staff is well trained"
Dr. Zachary Gleit,"Dr. Gleit is a great doctor: very professional, with excellent surgical skills, very knowledgeable , and great bedside manner. He repaired my bilateral inguinal hernia. The incisions are small and the pain has been minimal during recovery. He is also very patient. He answered all my questions before and after surgery. I would highly recommend dr. Gleit"
