Dr. Justin Greisberg,"Dr. Greisberg is one of those rare doctors who make you feel better as soon as they come into the room. He's been as good as he could possibly be for me, today and in the past."
Dr. Justin Greisberg,Dr. Gresberg is a great Dr. My foot is feeling much better. It was a long prosee but he did a great job.
Dr. Justin Greisberg,"Dr. Greisberg was recommended to me by a friend who been operated on by him and was very happy with proposed surgery and results. I am tremendously happy with how everything has gone with my tendon repair and follow-up as well. I have been able to resume my normal activities as expected, and I believe the treatment which was not always the same opinion I had received from other doctors was the right one."
Dr. Justin Greisberg,"he is a great doctor. i had gone thru a process that i have never being experience before. he helped me get back on track after the lisfranc injury (surgery / screws removal) i been feeling great. i read some reviews after the post removal, some people has been gone thru worse but with Doctor Greisberg, i didnt experience any pain whatsoever. its being great."
Dr. Justin Greisberg,"My experience with Dr Greisberg was excellent. I would recommend him without reservation, both for his surgical skill and the clarity of his explanations."
Dr. Justin Greisberg,This is the 2nd time Dr. Greisberg has treated me for a torn achiles. I have found him knowledgeable and sensitive to my concerns. He shares his analysis and reasons for treatment in an open manner. I would highly recommend him.
Dr. Justin Greisberg,"I fell down stairs and broke my ankle in three places. After spending a night at a trauma center I was transferred to be treated by Dr. Greisberg and his team. My ankle was reset properly and I received superior care. My surgery was a challenge and four months later I am walking unassisted and back in a gym. I am grateful to Dr. Geisberg for his professionalism, accessibility, care and surgical skill. This team is with out a doubt the best in the city."
Dr. Justin Greisberg,"This doctor is incompetent, he misdiagnosed my condition making me waste 6 months of my life. He miscalculated the severity of my broken ankle and the condition I have with osteoporosis. He didn't schedule me for surgery and the broken ankle didn't heal. In six months my ankle had only healed 10%. I changed doctors, and had a competent doctor do the surgery, but still I had to suffer for 6 months before having the surgery."
Dr. Justin Greisberg,If only I could put more stars I would! Dr Greisberg is such an outstanding and caring Doctor; he surpassed all our expectations! His expertise and level of care are unique! He was so caring about my well being before during and after my surgery. He listens and accommodated to all my needs. And the results: thanks G-od outstanding! Everyone is impressed by the results and my physical therapist told me in his 35 years career he never saw such a well done surgery!
Dr. Justin Greisberg,Dr. Greisberg is amazing. He performed surgery on my ankle and it is stronger than ever. I no longer have the pain and discomfort that I previously experienced. I would definitely recommend Dr. Greisberg to others.
Dr. Steven Beldner,"Dr. Beldner recently operated on my wrist to remove a ganglion cyst. Dr. Beldner and his whole team are professional, accessible, and caring. When you are with him and his team, you have their undivided attention. On the day of my surgery, Dr. Beldner even called me that evening to check on how I was feeling. I have full confidence in Dr. Beldner and his team and offer my highest recommendation."
Dr. Steven Beldner,Dr Beldner is one of the finest drs out there. i had a broken a finger and he found after a thorough examination there was an underlying issue of a tumor. i recently had surgery and he made me feel well at ease. He even called me later to check on me. I’ve never had a dr do that before. He has also assembled a fine team that works for him and they are very professional. I wouldn’t trust anyone else other than Dr. Beldner to take care of me. You should too. I highly recommend Dr. Beldner!
Dr. Steven Beldner,"I've had two great experiences with Dr. Beldner. He performed surgery to remove a ganglion cyst from my wrist, and recently treated me for tendonitis in the wrist/thumb. Both times he was extremely knowledgeable, professional, and pleasant. He was thorough, took the time to explain to me exactly what the problem was, what he recommended for treatment, and the probability of different possible outcomes regarding my reaction to the treatment. I highly recommend him!"
Dr. Steven Beldner,Dr. Beldner recently performed carpal tunnel surgery on my hand and I have nothing but good words to say about him. When he explained the procedure to me he broke it down in layman terms so I understood completely what was going to happen. He was friendly and courteous as is his staff. I would highly recommend Dr. Beldner to anyone who needs hand surgery. He answered all my questions and was very patient. I did not feel rushed at all. He is an excellent doctor.
Dr. Steven Beldner,"Great Guy! Awesome surgeon! 2 months after tfcc surgery I was back gigging with my band! Can't ask for anything more. Before the surgery, he exhibited patience and care while exhausting all other alternatives before doing the surgery. I wish all Doctors were more like Dr Beldner! His staff is just super."
Dr. Steven Beldner,"Great Guy! Awesome surgeon! 2 months after tfcc surgery I was back gigging with my band! Can't ask for anything more. Before the surgery, he exhibited patience and care while exhausting all other alternatives before doing the surgery. I wish all Doctors were more like Dr Beldner! His staff is just super."
Dr. Steven Beldner,I broke a finger and the ER physician told me I would need a hand surgeon. My insurance carrier made a superb recommendation in Dr. Beldner. He is absolutely excellent in his skill. He has a wonderful bedside manner that puts the patient at ease. I wholeheartedly recommend Dr. Beldner
Dr. Steven Beldner,"I would highly recommend Dr. Steven Beldner. Hands down the best doctor I have seen to date! Dr. Beldner and his staff are highly competent, professional, and thorough. I had a broken elbow and I was pretty anxious about my first surgery but they made me feel so comfortable, I never had to guess, and they always follow through. I am forever grateful to Dr. Beldner and his staff. From the bottom of my heart, THANK YOU!"
Dr. Steven Beldner,Great surgeon!! He once saved this pianist's pinky & let me keep tickling the ivories!
Dr. Steven Beldner,"The office is well organized and both the Dr. and his staff communicate well. I was first interviewed by his Physician Assistant and had x-rays taken in the office. I saw Dr. Beldner promptly. He already knew my concerns and had read the x-rays. He proceeded to ask additional questions and we fully discussed the diagnosis and my choices for various treatment options, downsides of each and likelihood of success. He treated me successfully in the office at that time. He is warm and caring."
Dr. Steven Beldner,"Great doctor and staff! Professional,sympathetic,thorough. Highly recommend!"
Dr. Steven Beldner,Highly recommend Dr Steven Beldner. He is very compassionate and friendly. He is the type of doctor who fully explains in detail your medical condition. He takes the time to make sure that the patient is comfortable. Loved being treated for wrist pain by this wonderful doctor.
Dr. Steven Beldner,Dr. Beldner is an excellent hand surgeon. He explains the injury and treatment plans very clearly. He is techically excellent in the operating room. I am a physician and he treated my injury very effectively and got me back to work at full strength. I have full confidence in him and refer all my colleagues and friends with hand and wrist problems to him.
Dr. Steven Beldner,"Dr. Beldner is great--he's kind, gentle and explains things in an accessible way. He's clearly and expert and I immediately trusted him to make the best decisions for my care. I'd recommend him without reservations to anyone."
Dr. Steven Beldner,"Dr. Beldner has been my hand/wrist/elbow surgeon for close to 20 years following years of competitive gymnastics. His expertise has given me back the use of my hands, and his referrals for excellent physical therapy has made all the difference in the world. I cannot recommend him more. He doesn't just treat your hand, he treats you as his valuable patient"
Dr. Steven Beldner,"I could not give enough accolades to Dr. Beldner and his entire staff. He is an outstanding surgeon having operated on my deformed pinky recently. He described the entire procedure to me in detail at the first and spent a lot of time with me. After the surgery he was always available to me for any questions or worries even texting him at any time which is very rare for doctors. He is prompt, empathic, down to earth and very professional. I would recommend him highly to anyone and actually have a"
Dr. Daniel Polatsch,Frightening
Dr. Daniel Polatsch,"I was sent to him by three people but he terrified me when he told me that I needed an operation on four fingers or I would be “crippled” and he couldnt then help me. He made me a splint so uncomfortable that my hand, which didn’t hurt when I went to see him, began hurting terribly. I also asked to get a referral to pt but he said no. I got a second opinion from a more seasoned hand surgeon who told me that I am not nearly at the point of requiring surgery and that they were many Other options"
Dr. Daniel Polatsch,"Dr. Polatsch is not the best hand doctor/surgeon. He is the BEST of the best! Period. I had ""trigger finger"" symptoms and went to one of the best NYU Langone hand doctors whom I visited twice but my fingers continue to worsen. I decided to visit Dr. Polatsch and he did exactly the same procedure (injections) as the doctor at NYU Langone but slightly differently in terms of which spots of the fingers were injected. I took note of that and the difference with the NYU Langone treatment"
Dr. Daniel Polatsch,Dr. Polatsch and his staff were amazing. I broke my wrist in a lot of pieces. He was able to see me urgently and operate on me rather quickly. I am getting therapy now and I see how much better I am doing than some of the other patients at my therapist office who has surgery before me by other docs. I am so happy my internist recommended Dr. Polatsch. I highly recommend him for ANY wrist problem
Dr. Daniel Polatsch,"Staff, in particular PA and officer manager were rude"
Dr. Daniel Polatsch,"After having pain and being in splints on and off with both hands, I now have full use of both hands and am completely splint free. Dr. Polatsch first operated on me two years ago for a tennis elbow on left arm. This past June he operated on my right hand and elbow for three trigger fingers, a nerve pressing on the elbow and tennis elbow. I am so grateful to him for his kindness, professionalism, and for being such a fantastic surgeon. It is great to be pain free."
Dr. Daniel Polatsch,"What a sweetie! I have had several minor hand surgeries, which went smoothly. I absolutely trust him and his staff. People with hand problems would be crazy to see anyone else."
Dr. Daniel Polatsch,"I had a very good experience. Dr. Polatsch examined my finger and gave me information to make a decision between an injection or surgery. . He listened and answered all of my questions. He is knowledgeable and professional. He was patient and gave me time to make a decision. Someone from his office called me the day after surgery to see how I was feeliing and shortly after I responded, Dr. Polatsch called me to discuss. He has a very nice bedside manner and his staff is friendly and courteous."
Dr. Jonathan Stieber,"Dr. Stieber operated on me 2x, successfully in 2014 to treat a herniated disk, a bulging disk, & spinal stenosis. In 2016 due to aging & my spine's tendancy for spinal stenosis & bulging disks he performed surgery for L2-L3 laminectomy with TLIF, L5-S1 transfacet decompression with TLIF, and L2-S1 instrumentation. Doc once again did all he could to alleviate my discomfort. I'm a little stiff now but a daily dose of an NSAID relieves that. I consider him a very honest and skilled surgeon."
Dr. Jonathan Stieber,"This doctor is very unprofessional and mean in his patient relation. He disrespected, humiliated and dehumanized me all because of his staff incompetence and inability to their job at a timely manner that resulted in NYU cancelling my surgery booking. I have requested his office to schedule a pre- surgical appointment with NYU physician under my Workman's case, as I couldn't get it done with my PC. Next, Dr Steiber threw my case out, declined my numerous request for an appt to talk him."
Dr. Russel Huang,I had excruciating leg pain due to a herniated disc. I went to a few Doctors before deciding on Dr. Huang. It's now been five years since Dr. Huang performed my surgery and I can't be happier with the results. I am and have been pain free since the moment I woke up in recovery at HSS.
Dr. Russel Huang,I went to see Dr. Huang with my dad. My dad needs surgery for his back. I have never seen an doctor answer so many questions in my life. He was not at all dismissive and explained the procedure to my dad maybe 5 times. Although my dad was seen in the clinic it was still worth it. The only negative I would say is the waiting time as he sees patients only once a month in the clinic. Otherwise he is an amazing and gives a lot of respect to his patients.
Dr. Russel Huang,"Last week, as I was walking down the street, I saw Dr. Huang; this brought back feelings of disgust. I remember my appointment with him a couple years ago and how it was the worst experience I've had with any doctor. When I told Dr. Huang that I was in unbearable pain to the point where I wanted to die, he was extremely dismissive and obnoxious. What made the situation worse was that he was training a man and still showed no professionalism or concern. I wish I hadn't wasted my time and money"
Dr. Russel Huang,I had my 6th back surgery with Dr.Huang. I've seen quite a few doctors prior to him. That was my biggest mistake. Dr Huang explained to me what was about to happen. He truly put my mind at ease. I am so grateful for him his colleges & his staff. As long as I'm able to be treated by him he will continue to be my surgeon. If there were more space I'd type so many more comments about him. I can't say enough good things. Dr. Huang is an exceptional surgeon & again I'm extremely grateful
Dr. Russel Huang,Good doctor
Dr. Russel Huang,"Excellent Dr. Performed spinal fusion on my 12 year old daughter, and from the time she was diagnosed till after the surgery he was there every step of the way. I would not recommend anyone else"
Dr. Russel Huang,Still suffering
Dr. Russel Huang,Was this helpful?
Dr. Russel Huang,"My experience at Dr. Huang's office was excellent. He explained all procedures, was available via text messaging which made both pre and post op easier. Surgery went very well! Many thanks to Dr. Huang."
Dr. Russel Huang,DR HUANG SAVED MY LIFE AND GAVE ME BACK THE QUALITY OF LIFE THAT I HAD BEFORE MY ACCIDENT.WHEN I FIRST MET HIM I KNEW I WOULD BE OK. I THINK THAT HE IS THE MOST CARING AND TALENTED SURGEON AND MAN IN THIS WORLD. THERE ARE NOT ENOUGH WORDS TO THANK HIM FOR ALL HE HAS DONE FOR ME.
Dr. Edwin Su,"10 months after my hip replacement by Dr. Edwin Su, I can resume all activities including skiing!! Unbelievable quick recovery"
Dr. Edwin Su,I went for several opinions and I live in Philadelphia. I was young and found out about hip resurfacing and came to Dr. Su via a web site called surfacehippy.com that is great. Dr Su was fantastic I immediately felt confident that he could help me and he is caring and overall was outstanding I am a physician as well and he is a doctors doctor. The hospital was great too. I am almost 7 years out form my resurfacing and cannot recommend him highly enough 5 stars for sure!
Dr. Edwin Su,"Dr. Su changed my life! Seriously. Dr. Su, his associates and staff are all amazing people. And, everyone at HSS was fantastic. I had a hip re-surfacing 2 months ago. I was walking almost immediately after surgery and was only mildly uncomfortable...no real pain. Two months out and I feel amazing. I am singing their praises to anyone who will listen. My cousin in California needs hip surgery and I'm insisting she come to NYC, HSS and Dr. Su."
Dr. Edwin Su,"Surgeon skill and experience are the central considerations when having a hip resurfaced. Dr. Su's skill and experience are unsurpassed. I would not trust any other doctor to perform my resurfacing. I am five weeks out of surgery and have resumed all normal daily activities. I've been pain free from the moment I awoke after the procedure. My smooth recovery is largely a testament to his skill. If you're considering a hip resurfacing, make an appointment with Dr. Su. You'll be glad you did!"
Dr. Edwin Su,"Dr. Su is an amazing surgeon! I livein Charleston South Carolina and travelled to New York City to have Dr. Su do bilateral hip replacements. I am a physician myself and I knew that Dr. Su would do the best job possible for me. Just 2 weeks ago I had both hips done and my recovery has been a breeze. I know that it is the expertise of Dr. Su that is allowing me to have such a great recovery. Before my surgery, I could hardly walk and just after two weeks, I am walking city blocks."
Dr. Edwin Su,"I had my total hip replacement in October 2014, after over three years I can say without any hesitation that Dr.Edwin Su is a perfect example of a gifted surgeon, his Staff is more than excellent, especially Christina. Regarding the HSS overall service I could not be more satisfied, This hospital is out of this world, you can not compare the outstanding patient care and selection of staff there, about Dr.Edwin Su skills, well my hip operation was a total success ""perfect"".. Thank You Dr. Su."
Dr. Edwin Su,"After my co-worker and friend, Victor Shimmons, recommended Dr. Su I was a little skeptical. I did some research and decided Dr. Su was the best choice. Sure enough, 3 weeks later, I know made the best decision of my life. My surgery was on November 28th 2017. I can walk with a cane, bathe myself and get around really well! Dr. Su has a great bedside manner, is trustworthy and caring. I highly recommend him in any capacity. His staff is also very attentive and caring."
Dr. Edwin Su,"Dr Su did my total hip replacement .He is an excellent surgeon & i was up & walking right away. my whole experience was perfect from the moment i entered HSS. Christina who works In Dr Sus office was exceptional as well. I would recommend Dr Su 100%,he is the BEST!!!!!"
Dr. Edwin Su,"Left me crippled and unable to walk and in constant pain 24/7, with less movement in my hip than prior to the surgery. Then told me he could do nothing for me. Was lucky to find another surgeon who easily reconstructed the hip and now able to do yoga, walk miles and have a life again."
Dr. Edwin Su,Excellent surgeon. Highly recommend
Dr. Edwin Su,"Dr. Su is a gifted surgeon as well as a lovely person. He is well-versed on the most up-to-date procedures. I felt completely comfortable from the first time I met him, and he took his time to explain the procedure to me (anterior procedure of total hip replacement). My surgery went well, and I now feel like I have a new lease on life. I have no pain when I walk, and can do my 10,000 steps a day. I can't recommend him highly enough."
Dr. Edwin Su,"I am a female in my late 60's, not typical for Dr Su. Nonetheless he resurfaced each of my hips and each surgery was beautifully done with minimal scarring and great results, 3 and 7 years ago. When I needed a total knee replacement I was delighted to learn that one third of Dr Su's practice is knees. Within four weeks of his replacing my knee I had full flexion and could walk without assistance. Now at 10 weeks I am working on strength. Experienced PT's are amazed at my outstanding results."
Dr. Edwin Su,"I had both hips resurfaced 2 years apart. Dr. Su gave me back my active lifestyle. I can swim, bike and jog with no hip pain. Dr. Su is the best in hip resurfacing."
Dr. Edwin Su,"This MD met all my needs with the Birmingham Resurfacing. I was so grateful to him for performing this surgery on me. I was back on the job in 3 weeks. I made him my Health Care Proxy for the surgery, as only he could decide what I needed."
Dr. Edwin Su,"Simply the best! Responsive, thoughtful, innovative, and extraordinary competent. Interviewed 2 other doctors, before selecting. I chose to travel 2700 miles to use him, and had an outstanding outcome from hip resurfacing. Well worth the trip and effort, and great follow-up attention whenever there were questions or special assistance was needed. Would not hesitate to recommend HSS and Dr.Su to anyone wanting the best professional care available for hip surgery."
Dr. Edwin Su,I simply can't imagine a better experience. If you ever need a hip surfacing surgery Dr. Su is probably one of the best specialist in the world. !!!!
Dr. Edwin Su,I had complications after surgery. Once i started having complications the office seemed to lose interest and usually would not get back to me. I had to call many times and even then took 2 - 3 weeks to get any kind of response if i got a response at all. My emails to the PA were mostly ignored.
Dr. Edwin Su,The surgery appears to have gone very well. I had what appears to have been a small dural nick which has caused subsequent headaches. The recovery of the hip has been rapid in just 1.5 weeks.
Dr. Melvin Rosenwasser,"Dr. Rosenwasser is the best! After breaking my arm playing baseball, he was quick to help and perform a perfect surgery. Without his expertise D1 baseball would not have been a possibility again!! So grateful for such an amazing doctor"
Dr. Melvin Rosenwasser,"I would NOT recommend seeing Dr. Rosenwasser. He is obviously well qualified and an intelligent person, however his lack of care, respect, and attention are what make him a horrible doctor. If you want someone who will be attentive to your case and will provide solutions, he is NOT the doctor for you. He treated me like absolute garbage and gave me no time of day (treated me like I was a bother). Faculty is rude and had multiple forms incorrectly process on their end."
Dr. Melvin Rosenwasser,Dr Melvin Rosenwasser is an excellent hand surgeon who pays special attention to his patients concerns and makes sure they get the best possible result when he operates. He is extremely patient and knowledgeable in orthopedics and answers every question a patient has during the visit. I had a biceps tendon rupture and it healed completely without any complications in about 3 months. I would recommend him highly. S. C. Shekher
Dr. Melvin Rosenwasser,"Amazing, caring, patient, superior surgical results!"
Dr. Melvin Rosenwasser,"Dr. Rosenwasser and his staff were excellent. The level of care was outstanding, and the doctor took time to explain all procedures and options. All were friendly and helpful."
Dr. Melvin Rosenwasser,"got to the appointment went in for an x ray only to find out after that they made a mistake and dint accept my insurance, paid 500 out of pocket and was told the 250 for the xray would be covered, it wasn't, and the staff is very unhelpful"
Dr. Melvin Rosenwasser,"Dr.Rosenwasser is an exceptional surgeon! I had unresolved complications from a prior surgery involving ulnar nerve, ulnar ligament, & forearm flexor. I compete in Division I athletics but feared my issues were unresolvable and career over, and worried about long term effects. Dr. Rosenwasser expertly addressed all issues, essentially rebuilding my arm. I have now completed rehab and am throwing freely and with strength, thrilled and looking forward to this spring season."
Dr. Melvin Rosenwasser,Very good. My surgery (radiofrequency capsular shrinkage for an overstretched scapholunate ligament in my dominant wrist) was a complete success and exactly within the time frame he gave me.
Dr. Melvin Rosenwasser,"Dr. Rosenwasser is a kind and caring man. He explains everything thoroughly and answers every question that is asked. Thanks to him, I can now hold my grandson with confidence ( and there is no better feeling.) Not a day goes by that I am not grateful for the mobility that his skill and expertise has afforded me"
Dr. Melvin Rosenwasser,"My experience with Dr. Rosenwasser was very positive. I was lucky enough to be referred to him by a friend who is an orthopedic surgeon, and was told he was one of the best hand surgeons in the county. Dr. Rosenwasser expertly repaired by broken wrist, and I healed extremely well. The occupational therapist working with me, marveled at my quick progress. It has been four months since I had the surgery and my hand is back to normal again. I am very grateful to Dr. Rosenwasser."
Dr. Melvin Rosenwasser,"Dr. Rosenwasser's pioneering surgical technique (RASL) for addressing torn scapholunate ligaments restored my wrist to near full function. After visiting 5 other surgeons and exhaustively studying literature on alternative surgical techniques, I concluded it was not close. The RASL surgery that Dr. R so skillfully performed on my wrist 5 years ago has allowed me at age 70 to keep up a very active life style--golf, basketball, biking, lifting weights, chopping wood, etc. Dr. R is outstanding."
